{"schema_version":1,"experiment_id":"run-handle-grid","spec_fingerprint":"393546fcdb62ea12","total_candidates":2,"completed_candidates":2,"succeeded_candidates":2,"failed_candidates":0,"candidates":[{"ordinal":1,"parameters":{"fast_window":1},"outcome":{"run_id":"run-handle-grid-0001","instrument":"BTCUSDT.BINANCE","result_hash":"bf3c59b2ef47e793","data_fingerprint":"barframe:64649c76c98d3b02","fills":7,"equity_points":80,"return_bps":8,"max_drawdown_bps":0,"artifacts":{"run_manifest":"D:\\aex_work\\qianxing\\crates\\qx-cli\\.task-tmp\\qx-app-tests/run-handle-experiment-11884-68\\out\\run-handle-grid\\run-0001\\run-handle-grid-0001.run.json","summary":"D:\\aex_work\\qianxing\\crates\\qx-cli\\.task-tmp\\qx-app-tests/run-handle-experiment-11884-68\\out\\run-handle-grid\\run-0001\\run-handle-grid-0001.summary.json","equity":"D:\\aex_work\\qianxing\\crates\\qx-cli\\.task-tmp\\qx-app-tests/run-handle-experiment-11884-68\\out\\run-handle-grid\\run-0001\\run-handle-grid-0001.equity.csv","fills":"D:\\aex_work\\qianxing\\crates\\qx-cli\\.task-tmp\\qx-app-tests/run-handle-experiment-11884-68\\out\\run-handle-grid\\run-0001\\run-handle-grid-0001.fills.csv"}},"error":null},{"ordinal":2,"parameters":{"fast_window":2},"outcome":{"run_id":"run-handle-grid-0002","instrument":"BTCUSDT.BINANCE","result_hash":"1f30e754d79aba92","data_fingerprint":"barframe:64649c76c98d3b02","fills":7,"equity_points":80,"return_bps":5,"max_drawdown_bps":0,"artifacts":{"run_manifest":"D:\\aex_work\\qianxing\\crates\\qx-cli\\.task-tmp\\qx-app-tests/run-handle-experiment-11884-68\\out\\run-handle-grid\\run-0002\\run-handle-grid-0002.run.json","summary":"D:\\aex_work\\qianxing\\crates\\qx-cli\\.task-tmp\\qx-app-tests/run-handle-experiment-11884-68\\out\\run-handle-grid\\run-0002\\run-handle-grid-0002.summary.json","equity":"D:\\aex_work\\qianxing\\crates\\qx-cli\\.task-tmp\\qx-app-tests/run-handle-experiment-11884-68\\out\\run-handle-grid\\run-0002\\run-handle-grid-0002.equity.csv","fills":"D:\\aex_work\\qianxing\\crates\\qx-cli\\.task-tmp\\qx-app-tests/run-handle-experiment-11884-68\\out\\run-handle-grid\\run-0002\\run-handle-grid-0002.fills.csv"}},"error":null}],"comparison":{"schema_version":1,"instrument":"BTCUSDT.BINANCE","data_fingerprint":"barframe:64649c76c98d3b02","runs":[{"rank":1,"run":{"run_id":"run-handle-grid-0001","instrument":"BTCUSDT.BINANCE","data_fingerprint":"barframe:64649c76c98d3b02","result_hash":"bf3c59b2ef47e793","return_bps":8,"max_drawdown_bps":0}},{"rank":2,"run":{"run_id":"run-handle-grid-0002","instrument":"BTCUSDT.BINANCE","data_fingerprint":"barframe:64649c76c98d3b02","result_hash":"1f30e754d79aba92","return_bps":5,"max_drawdown_bps":0}}]},"artifact_path":"D:\\aex_work\\qianxing\\crates\\qx-cli\\.task-tmp\\qx-app-tests/run-handle-experiment-11884-68\\out\\run-handle-grid\\run-handle-grid.experiment.json"}