{"schema_version":1,"experiment_id":"sdk-walk-forward","spec_fingerprint":"224caf8b59eb124d","total_candidates":2,"completed_candidates":2,"succeeded_candidates":1,"failed_candidates":1,"candidates":[{"ordinal":1,"parameters":{"fast_window":2},"outcome":{"run_id":"sdk-walk-forward-0001","instrument":"BTCUSDT.BINANCE","result_hash":"33b9c1634e99eb52","data_fingerprint":"barframe:1ac9ec96c1154b1f","fills":1,"equity_points":70,"return_bps":1,"max_drawdown_bps":0,"artifacts":{"run_manifest":"D:\\aex_work\\qianxing\\crates\\qx-sdk\\.task-tmp\\test-temp\\qx-sdk-consumer/experiment-22144\\sdk-walk-forward\\run-0001\\sdk-walk-forward-0001.run.json","summary":"D:\\aex_work\\qianxing\\crates\\qx-sdk\\.task-tmp\\test-temp\\qx-sdk-consumer/experiment-22144\\sdk-walk-forward\\run-0001\\sdk-walk-forward-0001.summary.json","equity":"D:\\aex_work\\qianxing\\crates\\qx-sdk\\.task-tmp\\test-temp\\qx-sdk-consumer/experiment-22144\\sdk-walk-forward\\run-0001\\sdk-walk-forward-0001.equity.csv","fills":"D:\\aex_work\\qianxing\\crates\\qx-sdk\\.task-tmp\\test-temp\\qx-sdk-consumer/experiment-22144\\sdk-walk-forward\\run-0001\\sdk-walk-forward-0001.fills.csv"}},"error":null},{"ordinal":2,"parameters":{"fast_window":3},"outcome":null,"error":"{\"action\":\"FIX_INPUT\",\"category\":\"INVALID_INPUT\",\"correlation_id\":null,\"message\":\"BuiltinStrategySpec 快慢窗口必须为正且快线短于慢线\",\"retry\":\"NEVER\",\"safe_to_retry\":false,\"source_code\":null}"}],"comparison":null,"out_of_sample":{"folds":[{"fold":1,"train_range":[0,30],"test_range":[30,40],"selected_ordinal":1,"selected_parameters":{"fast_window":2},"in_sample_return_bps":0,"out_of_sample_return_bps":0},{"fold":2,"train_range":[10,40],"test_range":[40,50],"selected_ordinal":1,"selected_parameters":{"fast_window":2},"in_sample_return_bps":0,"out_of_sample_return_bps":0},{"fold":3,"train_range":[20,50],"test_range":[50,60],"selected_ordinal":1,"selected_parameters":{"fast_window":2},"in_sample_return_bps":0,"out_of_sample_return_bps":0},{"fold":4,"train_range":[30,60],"test_range":[60,70],"selected_ordinal":1,"selected_parameters":{"fast_window":2},"in_sample_return_bps":0,"out_of_sample_return_bps":0}],"in_sample_return_bps":0,"out_of_sample_return_bps":0,"degradation_bps":0},"baselines":[{"name":"buy-and-hold","return_bps":-409,"max_drawdown_bps":2227},{"name":"zero-signal","return_bps":0,"max_drawdown_bps":0}],"artifact_path":"D:\\aex_work\\qianxing\\crates\\qx-sdk\\.task-tmp\\test-temp\\qx-sdk-consumer/experiment-22144\\sdk-walk-forward\\sdk-walk-forward.experiment.json"}