{"schema_version":1,"experiment_id":"classic-strategy-selection-oos","spec_fingerprint":"d4200855cc8c1379","total_candidates":3,"completed_candidates":3,"succeeded_candidates":3,"failed_candidates":0,"candidates":[{"ordinal":1,"strategy_kind":"ema_cross","parameters":{},"outcome":{"run_id":"classic-strategy-selection-oos-0001","instrument":"BTCUSDT.BINANCE","result_hash":"4c9563dc227533da","data_fingerprint":"barframe:e4394cde841beb26","fills":8,"equity_points":90,"return_bps":6,"max_drawdown_bps":0,"artifacts":{"run_manifest":"D:\\aex_work\\qianxing\\crates\\qx-cli\\.task-tmp\\qx-app-tests/classic-strategy-selection-11884-80\\out\\classic-strategy-selection-oos\\run-0001\\classic-strategy-selection-oos-0001.run.json","summary":"D:\\aex_work\\qianxing\\crates\\qx-cli\\.task-tmp\\qx-app-tests/classic-strategy-selection-11884-80\\out\\classic-strategy-selection-oos\\run-0001\\classic-strategy-selection-oos-0001.summary.json","equity":"D:\\aex_work\\qianxing\\crates\\qx-cli\\.task-tmp\\qx-app-tests/classic-strategy-selection-11884-80\\out\\classic-strategy-selection-oos\\run-0001\\classic-strategy-selection-oos-0001.equity.csv","fills":"D:\\aex_work\\qianxing\\crates\\qx-cli\\.task-tmp\\qx-app-tests/classic-strategy-selection-11884-80\\out\\classic-strategy-selection-oos\\run-0001\\classic-strategy-selection-oos-0001.fills.csv"}},"error":null},{"ordinal":2,"strategy_kind":"macd","parameters":{},"outcome":{"run_id":"classic-strategy-selection-oos-0002","instrument":"BTCUSDT.BINANCE","result_hash":"68128f48bfbc00de","data_fingerprint":"barframe:e4394cde841beb26","fills":6,"equity_points":90,"return_bps":-3,"max_drawdown_bps":4,"artifacts":{"run_manifest":"D:\\aex_work\\qianxing\\crates\\qx-cli\\.task-tmp\\qx-app-tests/classic-strategy-selection-11884-80\\out\\classic-strategy-selection-oos\\run-0002\\classic-strategy-selection-oos-0002.run.json","summary":"D:\\aex_work\\qianxing\\crates\\qx-cli\\.task-tmp\\qx-app-tests/classic-strategy-selection-11884-80\\out\\classic-strategy-selection-oos\\run-0002\\classic-strategy-selection-oos-0002.summary.json","equity":"D:\\aex_work\\qianxing\\crates\\qx-cli\\.task-tmp\\qx-app-tests/classic-strategy-selection-11884-80\\out\\classic-strategy-selection-oos\\run-0002\\classic-strategy-selection-oos-0002.equity.csv","fills":"D:\\aex_work\\qianxing\\crates\\qx-cli\\.task-tmp\\qx-app-tests/classic-strategy-selection-11884-80\\out\\classic-strategy-selection-oos\\run-0002\\classic-strategy-selection-oos-0002.fills.csv"}},"error":null},{"ordinal":3,"strategy_kind":"sma_cross","parameters":{},"outcome":{"run_id":"classic-strategy-selection-oos-0003","instrument":"BTCUSDT.BINANCE","result_hash":"11bedb024394850e","data_fingerprint":"barframe:e4394cde841beb26","fills":8,"equity_points":90,"return_bps":6,"max_drawdown_bps":0,"artifacts":{"run_manifest":"D:\\aex_work\\qianxing\\crates\\qx-cli\\.task-tmp\\qx-app-tests/classic-strategy-selection-11884-80\\out\\classic-strategy-selection-oos\\run-0003\\classic-strategy-selection-oos-0003.run.json","summary":"D:\\aex_work\\qianxing\\crates\\qx-cli\\.task-tmp\\qx-app-tests/classic-strategy-selection-11884-80\\out\\classic-strategy-selection-oos\\run-0003\\classic-strategy-selection-oos-0003.summary.json","equity":"D:\\aex_work\\qianxing\\crates\\qx-cli\\.task-tmp\\qx-app-tests/classic-strategy-selection-11884-80\\out\\classic-strategy-selection-oos\\run-0003\\classic-strategy-selection-oos-0003.equity.csv","fills":"D:\\aex_work\\qianxing\\crates\\qx-cli\\.task-tmp\\qx-app-tests/classic-strategy-selection-11884-80\\out\\classic-strategy-selection-oos\\run-0003\\classic-strategy-selection-oos-0003.fills.csv"}},"error":null}],"comparison":{"schema_version":1,"instrument":"BTCUSDT.BINANCE","data_fingerprint":"barframe:e4394cde841beb26","runs":[{"rank":1,"run":{"run_id":"classic-strategy-selection-oos-0001","instrument":"BTCUSDT.BINANCE","data_fingerprint":"barframe:e4394cde841beb26","result_hash":"4c9563dc227533da","return_bps":6,"max_drawdown_bps":0}},{"rank":2,"run":{"run_id":"classic-strategy-selection-oos-0003","instrument":"BTCUSDT.BINANCE","data_fingerprint":"barframe:e4394cde841beb26","result_hash":"11bedb024394850e","return_bps":6,"max_drawdown_bps":0}},{"rank":3,"run":{"run_id":"classic-strategy-selection-oos-0002","instrument":"BTCUSDT.BINANCE","data_fingerprint":"barframe:e4394cde841beb26","result_hash":"68128f48bfbc00de","return_bps":-3,"max_drawdown_bps":4}}]},"out_of_sample":{"folds":[{"fold":1,"train_range":[0,20],"test_range":[20,30],"selected_ordinal":1,"selected_strategy_kind":"ema_cross","selected_parameters":{},"in_sample_return_bps":1,"out_of_sample_return_bps":0},{"fold":2,"train_range":[10,30],"test_range":[30,40],"selected_ordinal":1,"selected_strategy_kind":"ema_cross","selected_parameters":{},"in_sample_return_bps":1,"out_of_sample_return_bps":0},{"fold":3,"train_range":[20,40],"test_range":[40,50],"selected_ordinal":1,"selected_strategy_kind":"ema_cross","selected_parameters":{},"in_sample_return_bps":1,"out_of_sample_return_bps":0},{"fold":4,"train_range":[30,50],"test_range":[50,60],"selected_ordinal":1,"selected_strategy_kind":"ema_cross","selected_parameters":{},"in_sample_return_bps":1,"out_of_sample_return_bps":0},{"fold":5,"train_range":[40,60],"test_range":[60,70],"selected_ordinal":1,"selected_strategy_kind":"ema_cross","selected_parameters":{},"in_sample_return_bps":1,"out_of_sample_return_bps":0},{"fold":6,"train_range":[50,70],"test_range":[70,80],"selected_ordinal":1,"selected_strategy_kind":"ema_cross","selected_parameters":{},"in_sample_return_bps":1,"out_of_sample_return_bps":0},{"fold":7,"train_range":[60,80],"test_range":[80,90],"selected_ordinal":1,"selected_strategy_kind":"ema_cross","selected_parameters":{},"in_sample_return_bps":1,"out_of_sample_return_bps":0}],"in_sample_return_bps":1,"out_of_sample_return_bps":0,"degradation_bps":1},"artifact_path":"D:\\aex_work\\qianxing\\crates\\qx-cli\\.task-tmp\\qx-app-tests/classic-strategy-selection-11884-80\\out\\classic-strategy-selection-oos\\classic-strategy-selection-oos.experiment.json"}