{"schema_version":1,"experiment_id":"pure-addition","spec_fingerprint":"9086cf0d3aee1b60","total_candidates":2,"completed_candidates":2,"succeeded_candidates":2,"failed_candidates":0,"candidates":[{"ordinal":1,"parameters":{"fast_window":1},"outcome":{"run_id":"pure-addition-0001","instrument":"BTCUSDT.BINANCE","result_hash":"e5bbe33d059e4e0f","data_fingerprint":"barframe:7ed935b9b8683fdc","fills":3,"equity_points":40,"return_bps":3,"max_drawdown_bps":0,"artifacts":{"run_manifest":"D:\\aex_work\\qianxing\\crates\\qx-cli\\.task-tmp\\qx-app-tests/split-pure-addition-11884-31\\out\\pure-addition\\run-0001\\pure-addition-0001.run.json","summary":"D:\\aex_work\\qianxing\\crates\\qx-cli\\.task-tmp\\qx-app-tests/split-pure-addition-11884-31\\out\\pure-addition\\run-0001\\pure-addition-0001.summary.json","equity":"D:\\aex_work\\qianxing\\crates\\qx-cli\\.task-tmp\\qx-app-tests/split-pure-addition-11884-31\\out\\pure-addition\\run-0001\\pure-addition-0001.equity.csv","fills":"D:\\aex_work\\qianxing\\crates\\qx-cli\\.task-tmp\\qx-app-tests/split-pure-addition-11884-31\\out\\pure-addition\\run-0001\\pure-addition-0001.fills.csv"}},"error":null},{"ordinal":2,"parameters":{"fast_window":2},"outcome":{"run_id":"pure-addition-0002","instrument":"BTCUSDT.BINANCE","result_hash":"ab148aab82ee48a2","data_fingerprint":"barframe:7ed935b9b8683fdc","fills":3,"equity_points":40,"return_bps":2,"max_drawdown_bps":0,"artifacts":{"run_manifest":"D:\\aex_work\\qianxing\\crates\\qx-cli\\.task-tmp\\qx-app-tests/split-pure-addition-11884-31\\out\\pure-addition\\run-0002\\pure-addition-0002.run.json","summary":"D:\\aex_work\\qianxing\\crates\\qx-cli\\.task-tmp\\qx-app-tests/split-pure-addition-11884-31\\out\\pure-addition\\run-0002\\pure-addition-0002.summary.json","equity":"D:\\aex_work\\qianxing\\crates\\qx-cli\\.task-tmp\\qx-app-tests/split-pure-addition-11884-31\\out\\pure-addition\\run-0002\\pure-addition-0002.equity.csv","fills":"D:\\aex_work\\qianxing\\crates\\qx-cli\\.task-tmp\\qx-app-tests/split-pure-addition-11884-31\\out\\pure-addition\\run-0002\\pure-addition-0002.fills.csv"}},"error":null}],"comparison":{"schema_version":1,"instrument":"BTCUSDT.BINANCE","data_fingerprint":"barframe:7ed935b9b8683fdc","runs":[{"rank":1,"run":{"run_id":"pure-addition-0001","instrument":"BTCUSDT.BINANCE","data_fingerprint":"barframe:7ed935b9b8683fdc","result_hash":"e5bbe33d059e4e0f","return_bps":3,"max_drawdown_bps":0}},{"rank":2,"run":{"run_id":"pure-addition-0002","instrument":"BTCUSDT.BINANCE","data_fingerprint":"barframe:7ed935b9b8683fdc","result_hash":"ab148aab82ee48a2","return_bps":2,"max_drawdown_bps":0}}]},"artifact_path":"D:\\aex_work\\qianxing\\crates\\qx-cli\\.task-tmp\\qx-app-tests/split-pure-addition-11884-31\\out\\pure-addition\\pure-addition.experiment.json"}