{"schema_version":1,"experiment_id":"sma-grid","spec_fingerprint":"c33bd9590959f56a","total_candidates":2,"completed_candidates":2,"succeeded_candidates":2,"failed_candidates":0,"candidates":[{"ordinal":1,"parameters":{"fast_window":1},"outcome":{"run_id":"sma-grid-0001","instrument":"BTCUSDT.BINANCE","result_hash":"e74c199345976c6f","data_fingerprint":"barframe:a7a89a4942fa486f","fills":5,"equity_points":60,"return_bps":6,"max_drawdown_bps":0,"artifacts":{"run_manifest":"D:\\aex_work\\qianxing\\crates\\qx-cli\\.task-tmp\\qx-app-tests/experiment-grid-11884-93\\out\\sma-grid\\run-0001\\sma-grid-0001.run.json","summary":"D:\\aex_work\\qianxing\\crates\\qx-cli\\.task-tmp\\qx-app-tests/experiment-grid-11884-93\\out\\sma-grid\\run-0001\\sma-grid-0001.summary.json","equity":"D:\\aex_work\\qianxing\\crates\\qx-cli\\.task-tmp\\qx-app-tests/experiment-grid-11884-93\\out\\sma-grid\\run-0001\\sma-grid-0001.equity.csv","fills":"D:\\aex_work\\qianxing\\crates\\qx-cli\\.task-tmp\\qx-app-tests/experiment-grid-11884-93\\out\\sma-grid\\run-0001\\sma-grid-0001.fills.csv"}},"error":null},{"ordinal":2,"parameters":{"fast_window":2},"outcome":{"run_id":"sma-grid-0002","instrument":"BTCUSDT.BINANCE","result_hash":"8dd29f4453af582d","data_fingerprint":"barframe:a7a89a4942fa486f","fills":5,"equity_points":60,"return_bps":4,"max_drawdown_bps":0,"artifacts":{"run_manifest":"D:\\aex_work\\qianxing\\crates\\qx-cli\\.task-tmp\\qx-app-tests/experiment-grid-11884-93\\out\\sma-grid\\run-0002\\sma-grid-0002.run.json","summary":"D:\\aex_work\\qianxing\\crates\\qx-cli\\.task-tmp\\qx-app-tests/experiment-grid-11884-93\\out\\sma-grid\\run-0002\\sma-grid-0002.summary.json","equity":"D:\\aex_work\\qianxing\\crates\\qx-cli\\.task-tmp\\qx-app-tests/experiment-grid-11884-93\\out\\sma-grid\\run-0002\\sma-grid-0002.equity.csv","fills":"D:\\aex_work\\qianxing\\crates\\qx-cli\\.task-tmp\\qx-app-tests/experiment-grid-11884-93\\out\\sma-grid\\run-0002\\sma-grid-0002.fills.csv"}},"error":null}],"comparison":{"schema_version":1,"instrument":"BTCUSDT.BINANCE","data_fingerprint":"barframe:a7a89a4942fa486f","runs":[{"rank":1,"run":{"run_id":"sma-grid-0001","instrument":"BTCUSDT.BINANCE","data_fingerprint":"barframe:a7a89a4942fa486f","result_hash":"e74c199345976c6f","return_bps":6,"max_drawdown_bps":0}},{"rank":2,"run":{"run_id":"sma-grid-0002","instrument":"BTCUSDT.BINANCE","data_fingerprint":"barframe:a7a89a4942fa486f","result_hash":"8dd29f4453af582d","return_bps":4,"max_drawdown_bps":0}}]},"artifact_path":"D:\\aex_work\\qianxing\\crates\\qx-cli\\.task-tmp\\qx-app-tests/experiment-grid-11884-93\\out\\sma-grid\\sma-grid.experiment.json"}